{
  "Magic": "FolderRewindTemplate",
  "SchemaVersion": "1.0",
  "ExportedAtUtc": "2026-03-20T04:51:29.823958Z",
  "Template": {
    "Id": "c994034257cd439a8c57451d2e965d6f",
    "ShareId": "53e8ddc509064382978e6689e111f065",
    "TemplateId": "53e8ddc509064382978e6689e111f065",
    "ShareCode": "Z2HJ6",
    "Name": "\u6D4B\u8BD5\u914D\u7F6E1",
    "Author": "Leaf",
    "Description": "111",
    "GameName": "",
    "SteamAppId": null,
    "Version": "1.0",
    "BaseConfigType": "Default",
    "IsEncrypted": false,
    "IconGlyph": "\uE8D2",
    "DefaultConfigName": "\u6D4B\u8BD5\u914D\u7F6E",
    "CreatedUtc": "2026-03-20T01:53:52.3815894Z",
    "UpdatedUtc": "2026-03-20T04:33:24.6387795Z",
    "Archive": {
      "Format": "7z",
      "CompressionLevel": 3,
      "Method": "LZMA2",
      "KeepCount": 10,
      "Mode": 0,
      "SkipIfUnchanged": true,
      "CpuThreads": 0,
      "BackupBeforeRestore": false,
      "SafeRestoreEnabled": true,
      "VerifyArchiveBeforeRestore": true,
      "MaxSmartBackupsPerFull": 5,
      "SafeDeleteEnabled": true,
      "FileTypeHandlingEnabled": false,
      "FileTypeRules": []
    },
    "Automation": {
      "AutoBackupEnabled": false,
      "IntervalMode": true,
      "IntervalMinutes": 60,
      "RunOnAppStart": false,
      "ScheduledMode": false,
      "ScheduledHour": 3,
      "ScheduleEntries": [],
      "LastAutoBackupUtc": "0001-01-01T00:00:00",
      "LastScheduledRunDateLocal": "0001-01-01T00:00:00",
      "StopAfterNoChangeEnabled": false,
      "StopAfterNoChangeCount": 3,
      "ConsecutiveNoChangeCount": 0
    },
    "Filters": {
      "Blacklist": [],
      "UseRegex": false,
      "RestoreWhitelist": []
    },
    "Cloud": {
      "Enabled": false,
      "CommandMode": 0,
      "TemplateKind": 0,
      "ExecutablePath": "rclone.exe",
      "ArgumentsTemplate": "copyto \u0022{ArchiveFilePath}\u0022 \u0022{RemoteBasePath}/{ConfigName}/{FolderName}/{ArchiveFileName}\u0022",
      "WorkingDirectory": "",
      "TimeoutSeconds": 600,
      "RetryCount": 0,
      "RemoteBasePath": "remote:FolderRewind",
      "LastRunUtc": "0001-01-01T00:00:00",
      "LastExitCode": 0,
      "LastErrorMessage": ""
    },
    "ExtendedProperties": {},
    "RequiredPluginIds": [],
    "PathRules": [
      {
        "Id": "3f47c53faa39491e84526bc6a7151d35",
        "Name": "Books",
        "Segments": [
          {
            "Type": 1,
            "Value": "Documents"
          },
          {
            "Type": 0,
            "Value": "Books"
          }
        ],
        "Markers": [],
        "Confidence": 0.6,
        "AutoAdd": false
      }
    ]
  }
}